{
  "experiment": "gsn-retrieval-abc-example",
  "modes": ["A_cks", "B_code_only", "C_code_skills"],
  "mode_agents": {
    "A_cks": "planner",
    "B_code_only": "bench-planner-codeonly",
    "C_code_skills": "bench-planner-skills"
  },
  "shared_agents": {
    "implement": "implementer",
    "evaluate": "evaluator"
  },
  "tasks": [
    {
      "id": "STABLE-0001",
      "ticket": "bench/fixtures/tickets/STABLE-0001.json",
      "oracle": { "chainbench_test": "basic/consensus" }
    }
  ],
  "go_stablenet_root": "/abs/path/to/go-stablenet",
  "batch_size": 1
}
